{
  "$schema": "https://json-schema.org/draft/2020-12/schema",
  "$id": "current-base-runtime-profile-v1",
  "title": "RSC World Editor Current Base runtime profile",
  "type": "object",
  "additionalProperties": false,
  "required": ["schemaId", "manifestType", "variantId", "installabilityBlockers", "pluginSourceSets", "clientAssetSets", "clientContent", "definitionPolicy", "skillPolicy", "combatPolicy", "authoringPolicy", "statePolicy", "mapPolicy", "serverContent", "stateMigration", "installedExecutionVerifier", "installedLaunch", "requiredRuntimeClasses", "requiredClientClasses", "requiredPluginClasses", "advancedExclusions"],
  "properties": {
    "combatPolicy": {"const": {"contractId":"current-base-public-combat-v1","sourceCommit":"c0102e60774ab9c9076aabae49f6f97fb6fc4b00","sourcePath":"current-platform/runtime/current-base-v1/public-definitions/combat-policy.json","sha256":"4c0adebfbdc677a4cd6cc259a0596f7d56b20aa095080810230eb58cf55d955d","serverBundlePath":"conf/server/current-base-public-provenance/combat-policy.json","clientBundlePath":"Cache/current-base-definitions/provenance/combat-policy.json"}},
    "installedLaunch": {"const": {"contractId":"current-base-installed-launch-v1","descriptorSchema":"#/$defs/installedLaunchDescriptor","serverMainClass":"com.openrsc.server.CurrentBaseInstalledServer","clientMainClass":"orsc.CurrentBaseInstalledClient","arguments":["--launch","<absolute-descriptor>"],"serverClasspath":"<codeRoot>/core.jar:<codeRoot>/plugins.jar","clientClasspath":"<codeRoot>/Open_RSC_Client.jar","workingDirectory":"descriptor-workingRoot","platform":"posix","leasePolicy":"pre-existing-regular-role-lock-held-by-role-jvm-until-process-exit","leasePaths":["server.lock","client.lock"],"sessionPolicy":"runtime-random-256-bit-nonce-subdirectory-under-role-session-parent-retain-history","sessionAnnouncement":"INSTALLED_SESSION <nonce>","readyPolicy":"server-world-and-network-or-client-visible-window","shutdownPolicy":"exact-session-bound-shutdown-json-clean-save-before-process-exit","codeTreeHash":"sorted-utf8-relative-path-nul-sha256-nul","codeTreeModes":"regular-singly-linked-files-no-symlinks-or-special-entries","mapFingerprint":"sorted-utf8-relative-path-nul-decimal-size-nul-sha256-newline","rootPolicy":"canonical-absolute-code-working-map-state-installation-disjoint-side-state-may-nest-within-state","sideStatePolicy":"server-keypair-word-filters-ip-bans-client-settings-uid-privacy-preferences-and-user-remembered-credentials-persistent","configurationPolicy":"exact-reviewed-complete-server-config-no-connections-or-local-override","clientAuthentication":"normal-manual-login-no-credential-file","publicKeyPolicy":"exact-pem-sha256-server-pair-match-and-client-handshake-pin","startTimeoutSeconds":120,"clientRenderer":"software-desktop-window-v1","activeSelection":"installationRoot/active-launch.json","selectionPolicy":"closed-private-current-role-descriptor-sha256-rechecked-after-lease-before-game-init","pendingCutover":"installationRoot/pending-cutover.json-any-entry-refuses-after-lease-before-effects"}},
    "schemaId": {"const": "current-base-runtime-profile-v1"},
    "manifestType": {"const": "current-base-runtime-profile"},
    "variantId": {"const": "current-base-v1"},
    "installabilityBlockers": {
      "type": "array",
      "maxItems": 0,
      "items": false
    },
    "pluginSourceSets": {"$ref": "#/$defs/stringArray"},
    "clientAssetSets": {"$ref": "#/$defs/stringArray"},
    "clientContent": {
      "type": "object", "additionalProperties": false,
      "required": ["contentId", "manifestRole", "archiveRole"],
      "properties": {
        "contentId": {"const": "current-base-public-client-content-v1"},
        "manifestRole": {"const": "client-content-manifest"},
        "archiveRole": {"const": "client-content"}
      }
    },
    "skillPolicy": {"const": {"contractId":"current-base-public-skills-v1","skillCount":18,"sourceCommit":"c0102e60774ab9c9076aabae49f6f97fb6fc4b00","sourcePath":"current-platform/runtime/current-base-v1/public-definitions/skill-policy.json","sha256":"964af6e051d6011a6a85a5d1316d885cd1b1d6a1406345fb22249b1bda8bce76","serverBundlePath":"conf/server/current-base-public-provenance/skill-policy.json","clientBundlePath":"Cache/current-base-definitions/provenance/skill-policy.json"}},
    "definitionPolicy": {
      "type": "object",
      "additionalProperties": false,
      "required": [
        "policyId",
        "sourceCommit",
        "registryCounts",
        "customRegistryPolicy",
        "serverProvenanceRoot",
        "clientProvenanceRoot",
        "provenanceSha256"
      ],
      "properties": {
        "policyId": {
          "const": "current-base-public-effective-content-v1"
        },
        "sourceCommit": {
          "const": "c0102e60774ab9c9076aabae49f6f97fb6fc4b00"
        },
        "registryCounts": {
          "type": "object",
          "additionalProperties": false,
          "required": [
            "items",
            "npcs",
            "scenery",
            "boundaries",
            "tiles",
            "prayers",
            "spells"
          ],
          "properties": {
            "items": {
              "const": 1593
            },
            "npcs": {
              "const": 836
            },
            "scenery": {
              "const": 1296
            },
            "boundaries": {
              "const": 214
            },
            "tiles": {
              "const": 25
            },
            "prayers": {
              "const": 14
            },
            "spells": {
              "const": 48
            }
          }
        },
        "customRegistryPolicy": {
          "const": "stock-appended-data-not-advanced"
        },
        "serverProvenanceRoot": {
          "const": "conf/server/current-base-public-provenance"
        },
        "clientProvenanceRoot": {
          "const": "Cache/current-base-definitions/provenance"
        },
        "provenanceSha256": {
          "type": "object",
          "additionalProperties": false,
          "required": [
            "provenance.json",
            "gameplay-provenance.json",
            "visual-provenance.json",
            "effective-policy.json"
          ],
          "properties": {
            "provenance.json": {
              "const": "c5923ef6fc5b30b533a0652aa79bfca13d79c46eec95aa739e0faa15920bea0b"
            },
            "gameplay-provenance.json": {
              "const": "e6a858676e05b48f202a829bafc41dcc30bf0defe7490f6646433f03365c1d51"
            },
            "visual-provenance.json": {
              "const": "4eef5878ae3b1ab4e13f6d1cb2f583da2bde076ed8dd1de60f8d5c94656a0ce1"
            },
            "effective-policy.json": {
              "const": "b70f38f94b8c7b3a2cdaa86428fd2f3a8c6c2438badbd884024e3819c4a3908e"
            }
          }
        }
      }
    },
    "authoringPolicy": {
      "const": {
        "policyId": "current-base-isolated-authoring-v1",
        "stateRootProperty": "openrsc.currentBaseAuthoringStateRoot",
        "sqliteFile": "world_builder.db",
        "runtimeProfile": "adaptive-world-builder",
        "contentPolicy": "native-public-no-overlay"
      }
    },
    "statePolicy": {
      "type": "object",
      "additionalProperties": false,
      "required": ["contractId", "durableLocation", "migration", "rollback", "sqliteRootProperty", "sqliteFile", "sqliteRootPolicy", "sqliteOpenPolicy"],
      "properties": {
        "contractId": {"const": "canonical-public-state-v1"},
        "durableLocation": {"const": "outside-code-runtime"},
        "migration": {"const": "transactional"},
        "rollback": {"const": "exact-predecessor"},
        "sqliteRootProperty": {"const": "openrsc.currentBaseStateRoot"},
        "sqliteFile": {"const": "current_base.db"},
        "sqliteRootPolicy": {"const": "required-canonical-private-directory-disjoint-from-runtime"},
        "sqliteOpenPolicy": {"const": "existing-private-file-read-write-no-create"}
      }
    },
    "mapPolicy": {
      "type": "object", "additionalProperties": false,
      "required": ["rootProperty", "externalRootPolicy", "profileBinding", "defaultLocation"],
      "properties": {
        "rootProperty": {"const": "openrsc.worldBuilderInstalledMapRoot"},
        "externalRootPolicy": {"const": "canonical-absolute-directory-disjoint-from-runtime"},
        "profileBinding": {"const": "manifest-sha256-and-package-identity"},
        "defaultLocation": {"const": "profile-relative-package"}
      }
    },
    "serverContent": {
      "type": "object", "additionalProperties": false,
      "required": ["contentId", "manifestRole", "archiveRole", "configurationEntry", "definitionsRoot"],
      "properties": {
        "contentId": {"const": "current-base-public-content-v1"},
        "manifestRole": {"const": "server-content-manifest"},
        "archiveRole": {"const": "server-content"},
        "configurationEntry": {"const": "current-base.conf"},
        "definitionsRoot": {"const": "conf/server"}
      }
    },
    "stateMigration": {
      "type": "object", "additionalProperties": false,
      "required": ["migrationRowIds", "manifestRole", "toolArtifactRole", "mainClass", "supportedEngines"],
      "properties": {
        "migrationRowIds": {
          "type": "array", "minItems": 5, "maxItems": 5,
          "prefixItems": [
            {"const": "preservation-retro-sqlite-to-current-base-v1"},
            {"const": "preservation-core-sqlite-to-current-base-v1"},
            {"const": "preservation-initialized-sqlite-to-current-base-v1"},
            {"const": "preservation-retro-mariadb-to-current-base-v1"},
            {"const": "current-base-sqlite-to-current-base-v1"}
          ], "items": false
        },
        "manifestRole": {"const": "state-migration-manifest"},
        "toolArtifactRole": {"const": "server-runtime"},
        "mainClass": {"const": "com.openrsc.server.database.CurrentBaseStateMigration"},
        "supportedEngines": {
          "type": "array", "minItems": 2, "maxItems": 2,
          "prefixItems": [{"const": "sqlite"}, {"const": "mariadb"}], "items": false
        }
      }
    },
    "installedExecutionVerifier": {
      "type": "object", "additionalProperties": false,
      "required": ["verifierId", "manifestRole", "toolArtifactRole", "mainClass", "evidenceSchemaId"],
      "properties": {
        "verifierId": {"const": "current-base-installed-execution-v1"},
        "manifestRole": {"const": "installed-execution-verifier"},
        "toolArtifactRole": {"const": "server-runtime"},
        "mainClass": {"const": "com.openrsc.server.database.CurrentBaseInstalledExecutionVerifier"},
        "evidenceSchemaId": {"const": "current-base-installed-execution-evidence-v1"}
      }
    },
    "requiredRuntimeClasses": {"$ref": "#/$defs/stringArray"},
    "requiredClientClasses": {"$ref": "#/$defs/stringArray"},
    "requiredPluginClasses": {"$ref": "#/$defs/stringArray"},
    "advancedExclusions": {
      "type": "object",
      "additionalProperties": false,
      "required": ["pluginPrefixes", "clientResourcePrefixes", "configuration"],
      "properties": {
        "pluginPrefixes": {"$ref": "#/$defs/stringArray"},
        "clientResourcePrefixes": {"$ref": "#/$defs/stringArray"},
        "configuration": {
          "type": "object",
          "additionalProperties": false,
          "required": ["custom_improvements", "custom_landscape", "custom_sprites", "spawn_auction_npcs", "spawn_iron_man_npcs", "want_bank_presets", "want_clans", "want_combat_odyssey", "want_custom_banks", "want_custom_leather", "want_custom_quests", "want_custom_ui", "want_equipment_tab", "want_harvesting", "want_myworld", "want_new_rare_drop_tables", "want_runecraft"],
          "properties": {
            "custom_improvements": {"const": false},
            "custom_landscape": {"const": false},
            "custom_sprites": {"const": false},
            "spawn_auction_npcs": {"const": false},
            "spawn_iron_man_npcs": {"const": false},
            "want_bank_presets": {"const": false},
            "want_clans": {"const": false},
            "want_combat_odyssey": {"const": false},
            "want_custom_banks": {"const": false},
            "want_custom_leather": {"const": false},
            "want_custom_quests": {"const": false},
            "want_custom_ui": {"const": false},
            "want_equipment_tab": {"const": false},
            "want_harvesting": {"const": false},
            "want_myworld": {"const": false},
            "want_new_rare_drop_tables": {"const": false},
            "want_runecraft": {"const": false}
          }
        }
      }
    }
  },
  "$defs": {
    "installedLaunchSelection": {"type":"object","additionalProperties":false,"required":["schemaVersion","manifestType","installationId","serverDescriptorSha256","clientDescriptorSha256"],"properties":{"schemaVersion":{"const":1},"manifestType":{"const":"current-base-installed-selection"},"installationId":{"type":"string","format":"uuid"},"serverDescriptorSha256":{"type":"string","pattern":"^[0-9a-f]{64}$"},"clientDescriptorSha256":{"type":"string","pattern":"^[0-9a-f]{64}$"}}},
    "installedLaunchDescriptor": {"type":"object","additionalProperties":false,"required":["schemaVersion","manifestType","role","installationId","compositionIdentity","runtimeProfile","installedMapProfile","publicKey","mapRoot","codeRoot","workingRoot","stateRoot","sideStateRoot","installationRoot","sessionRoot","mapPackageFingerprintSha256","codeTreeSha256","configuration","endpoint"],"properties":{"schemaVersion":{"const":1},"manifestType":{"const":"current-base-installed-launch"},"role":{"enum":["server","client"]},"installationId":{"type":"string","pattern":"^[0-9a-f]{8}-[0-9a-f]{4}-[0-9a-f]{4}-[0-9a-f]{4}-[0-9a-f]{12}$"},"compositionIdentity":{"type":"object","additionalProperties":false,"required":["path","sha256"],"properties":{"path":{"type":"string","pattern":"^/"},"sha256":{"type":"string","pattern":"^[0-9a-f]{64}$"}}},"runtimeProfile":{"type":"object","additionalProperties":false,"required":["path","sha256"],"properties":{"path":{"type":"string","pattern":"^/"},"sha256":{"type":"string","pattern":"^[0-9a-f]{64}$"}}},"installedMapProfile":{"type":"object","additionalProperties":false,"required":["path","sha256"],"properties":{"path":{"type":"string","pattern":"^/"},"sha256":{"type":"string","pattern":"^[0-9a-f]{64}$"}}},"publicKey":{"type":"object","additionalProperties":false,"required":["path","sha256"],"properties":{"path":{"type":"string","pattern":"^/"},"sha256":{"type":"string","pattern":"^[0-9a-f]{64}$"}}},"mapRoot":{"type":"string","pattern":"^/"},"codeRoot":{"type":"string","pattern":"^/"},"workingRoot":{"type":"string","pattern":"^/"},"stateRoot":{"type":"string","pattern":"^/"},"sideStateRoot":{"type":"string","pattern":"^/"},"installationRoot":{"type":"string","pattern":"^/"},"sessionRoot":{"type":"string","pattern":"^/"},"mapPackageFingerprintSha256":{"type":"string","pattern":"^[0-9a-f]{64}$"},"codeTreeSha256":{"type":"string","pattern":"^[0-9a-f]{64}$"},"configuration":{"oneOf":[{"type":"object","additionalProperties":false,"required":["path","sha256"],"properties":{"path":{"type":"string","pattern":"^/"},"sha256":{"type":"string","pattern":"^[0-9a-f]{64}$"}}},{"type":"object","maxProperties":0,"additionalProperties":false,"required":[],"properties":{}}]},"endpoint":{"type":"object","additionalProperties":false,"required":["host","gamePort"],"properties":{"host":{"type":"string","pattern":"^[A-Za-z0-9][A-Za-z0-9.:-]{0,252}$"},"gamePort":{"type":"integer","minimum":1,"maximum":65535}}}},"allOf":[{"if":{"properties":{"role":{"const":"server"}}},"then":{"properties":{"configuration":{"type":"object","additionalProperties":false,"required":["path","sha256"],"properties":{"path":{"type":"string","pattern":"^/"},"sha256":{"type":"string","pattern":"^[0-9a-f]{64}$"}}}}},"else":{"properties":{"configuration":{"type":"object","maxProperties":0,"additionalProperties":false,"required":[],"properties":{}}}}}]},
    "stringArray": {
      "type": "array",
      "minItems": 1,
      "uniqueItems": true,
      "items": {"type": "string", "minLength": 1}
    }
  }
}
