{
  "schemaId": "current-base-runtime-profile-v1",
  "manifestType": "current-base-runtime-profile",
  "variantId": "current-base-v1",
  "installabilityBlockers": [],
  "pluginSourceSets": [
    "authentic",
    "shared"
  ],
  "clientAssetSets": [
    "platform-world-editor-ui"
  ],
  "clientContent": {
    "contentId": "current-base-public-client-content-v1",
    "manifestRole": "client-content-manifest",
    "archiveRole": "client-content"
  },
  "definitionPolicy": {
    "policyId": "current-base-public-effective-content-v1",
    "sourceCommit": "c0102e60774ab9c9076aabae49f6f97fb6fc4b00",
    "registryCounts": {
      "items": 1593,
      "npcs": 836,
      "scenery": 1296,
      "boundaries": 214,
      "tiles": 25,
      "prayers": 14,
      "spells": 48
    },
    "customRegistryPolicy": "stock-appended-data-not-advanced",
    "serverProvenanceRoot": "conf/server/current-base-public-provenance",
    "clientProvenanceRoot": "Cache/current-base-definitions/provenance",
    "provenanceSha256": {
      "provenance.json": "c5923ef6fc5b30b533a0652aa79bfca13d79c46eec95aa739e0faa15920bea0b",
      "gameplay-provenance.json": "e6a858676e05b48f202a829bafc41dcc30bf0defe7490f6646433f03365c1d51",
      "visual-provenance.json": "4eef5878ae3b1ab4e13f6d1cb2f583da2bde076ed8dd1de60f8d5c94656a0ce1",
      "effective-policy.json": "b70f38f94b8c7b3a2cdaa86428fd2f3a8c6c2438badbd884024e3819c4a3908e"
    }
  },
  "skillPolicy": {
    "contractId": "current-base-public-skills-v1",
    "skillCount": 18,
    "sourceCommit": "c0102e60774ab9c9076aabae49f6f97fb6fc4b00",
    "sourcePath": "current-platform/runtime/current-base-v1/public-definitions/skill-policy.json",
    "sha256": "964af6e051d6011a6a85a5d1316d885cd1b1d6a1406345fb22249b1bda8bce76",
    "serverBundlePath": "conf/server/current-base-public-provenance/skill-policy.json",
    "clientBundlePath": "Cache/current-base-definitions/provenance/skill-policy.json"
  },
  "authoringPolicy": {
    "policyId": "current-base-isolated-authoring-v1",
    "stateRootProperty": "openrsc.currentBaseAuthoringStateRoot",
    "sqliteFile": "world_builder.db",
    "runtimeProfile": "adaptive-world-builder",
    "contentPolicy": "native-public-no-overlay"
  },
  "combatPolicy": {
    "contractId": "current-base-public-combat-v1",
    "sourceCommit": "c0102e60774ab9c9076aabae49f6f97fb6fc4b00",
    "sourcePath": "current-platform/runtime/current-base-v1/public-definitions/combat-policy.json",
    "sha256": "4c0adebfbdc677a4cd6cc259a0596f7d56b20aa095080810230eb58cf55d955d",
    "serverBundlePath": "conf/server/current-base-public-provenance/combat-policy.json",
    "clientBundlePath": "Cache/current-base-definitions/provenance/combat-policy.json"
  },
  "statePolicy": {
    "contractId": "canonical-public-state-v1",
    "durableLocation": "outside-code-runtime",
    "migration": "transactional",
    "rollback": "exact-predecessor",
    "sqliteRootProperty": "openrsc.currentBaseStateRoot",
    "sqliteFile": "current_base.db",
    "sqliteRootPolicy": "required-canonical-private-directory-disjoint-from-runtime",
    "sqliteOpenPolicy": "existing-private-file-read-write-no-create"
  },
  "mapPolicy": {
    "rootProperty": "openrsc.worldBuilderInstalledMapRoot",
    "externalRootPolicy": "canonical-absolute-directory-disjoint-from-runtime",
    "profileBinding": "manifest-sha256-and-package-identity",
    "defaultLocation": "profile-relative-package"
  },
  "serverContent": {
    "contentId": "current-base-public-content-v1",
    "manifestRole": "server-content-manifest",
    "archiveRole": "server-content",
    "configurationEntry": "current-base.conf",
    "definitionsRoot": "conf/server"
  },
  "stateMigration": {
    "migrationRowIds": [
      "preservation-retro-sqlite-to-current-base-v1",
      "preservation-core-sqlite-to-current-base-v1",
      "preservation-initialized-sqlite-to-current-base-v1",
      "preservation-retro-mariadb-to-current-base-v1",
      "current-base-sqlite-to-current-base-v1"
    ],
    "manifestRole": "state-migration-manifest",
    "toolArtifactRole": "server-runtime",
    "mainClass": "com.openrsc.server.database.CurrentBaseStateMigration",
    "supportedEngines": ["sqlite", "mariadb"]
  },
  "installedExecutionVerifier": {
    "verifierId": "current-base-installed-execution-v1",
    "manifestRole": "installed-execution-verifier",
    "toolArtifactRole": "server-runtime",
    "mainClass": "com.openrsc.server.database.CurrentBaseInstalledExecutionVerifier",
    "evidenceSchemaId": "current-base-installed-execution-evidence-v1"
  },
  "installedLaunch": {
    "contractId": "current-base-installed-launch-v1",
    "descriptorSchema": "#/$defs/installedLaunchDescriptor",
    "serverMainClass": "com.openrsc.server.CurrentBaseInstalledServer",
    "clientMainClass": "orsc.CurrentBaseInstalledClient",
    "arguments": [
      "--launch",
      "<absolute-descriptor>"
    ],
    "serverClasspath": "<codeRoot>/core.jar:<codeRoot>/plugins.jar",
    "clientClasspath": "<codeRoot>/Open_RSC_Client.jar",
    "workingDirectory": "descriptor-workingRoot",
    "platform": "posix",
    "leasePolicy": "pre-existing-regular-role-lock-held-by-role-jvm-until-process-exit",
    "leasePaths": [
      "server.lock",
      "client.lock"
    ],
    "sessionPolicy": "runtime-random-256-bit-nonce-subdirectory-under-role-session-parent-retain-history",
    "sessionAnnouncement": "INSTALLED_SESSION <nonce>",
    "readyPolicy": "server-world-and-network-or-client-visible-window",
    "shutdownPolicy": "exact-session-bound-shutdown-json-clean-save-before-process-exit",
    "codeTreeHash": "sorted-utf8-relative-path-nul-sha256-nul",
    "codeTreeModes": "regular-singly-linked-files-no-symlinks-or-special-entries",
    "mapFingerprint": "sorted-utf8-relative-path-nul-decimal-size-nul-sha256-newline",
    "rootPolicy": "canonical-absolute-code-working-map-state-installation-disjoint-side-state-may-nest-within-state",
    "sideStatePolicy": "server-keypair-word-filters-ip-bans-client-settings-uid-privacy-preferences-and-user-remembered-credentials-persistent",
    "configurationPolicy": "exact-reviewed-complete-server-config-no-connections-or-local-override",
    "clientAuthentication": "normal-manual-login-no-credential-file",
    "publicKeyPolicy": "exact-pem-sha256-server-pair-match-and-client-handshake-pin",
    "startTimeoutSeconds": 120,
    "clientRenderer": "software-desktop-window-v1",
    "activeSelection": "installationRoot/active-launch.json",
    "selectionPolicy": "closed-private-current-role-descriptor-sha256-rechecked-after-lease-before-game-init",
    "pendingCutover": "installationRoot/pending-cutover.json-any-entry-refuses-after-lease-before-effects"
  },
  "requiredRuntimeClasses": [
    "com/openrsc/server/CurrentBaseCombatContract.class",
    "com/openrsc/server/CurrentBaseSkillContract.class",
    "com/openrsc/server/VerifierLifetime.class",
    "com/openrsc/server/CurrentBaseVerifierServer.class",
    "com/openrsc/server/database/CurrentBaseVerifierRecovery.class",
    "com/openrsc/server/CurrentInstalledLaunch.class",
    "com/openrsc/server/CurrentBaseInstalledServer.class",
    "com/openrsc/server/CurrentBasePublicContent.class",
    "com/openrsc/server/database/impl/sqlite/CurrentBaseStateLocation.class",
    "com/openrsc/server/database/CurrentBaseInstalledExecutionVerifier.class",
    "com/openrsc/server/database/CurrentBaseStateMigration.class",
    "com/openrsc/server/io/NativeLayeredWorldPackage.class",
    "com/openrsc/server/io/WorldBuilderInstalledServerProfile.class"
  ],
  "requiredClientClasses": [
    "orsc/CurrentBaseSkillContract.class",
    "orsc/VerifierLifetime.class",
    "orsc/CurrentBaseVerifierClient.class",
    "orsc/CurrentInstalledLaunch.class",
    "orsc/CurrentBaseInstalledClient.class",
    "orsc/CurrentBaseExecutionProfile.class",
    "orsc/CurrentCompositionIdentity.class",
    "orsc/WorldBuilderInstalledClientProfile.class"
  ],
  "requiredPluginClasses": [
    "com/openrsc/server/plugins/authentic/defaults/Default.class",
    "com/openrsc/server/plugins/authentic/quests/free/BlackKnightsFortress.class",
    "com/openrsc/server/plugins/shared/PlayerLogin.class",
    "com/openrsc/server/plugins/shared/PlayerDeath.class"
  ],
  "advancedExclusions": {
    "pluginPrefixes": [
      "com/openrsc/server/plugins/custom/",
      "com/openrsc/server/plugins/retro/"
    ],
    "clientResourcePrefixes": [
      "myworld-assets/animations/",
      "myworld-assets/legacy animation folder/",
      "myworld-assets/remastered-sprites/",
      "myworld-assets/sprites/"
    ],
    "configuration": {
      "custom_improvements": false,
      "custom_landscape": false,
      "custom_sprites": false,
      "spawn_auction_npcs": false,
      "spawn_iron_man_npcs": false,
      "want_bank_presets": false,
      "want_clans": false,
      "want_combat_odyssey": false,
      "want_custom_banks": false,
      "want_custom_leather": false,
      "want_custom_quests": false,
      "want_custom_ui": false,
      "want_equipment_tab": false,
      "want_harvesting": false,
      "want_myworld": false,
      "want_new_rare_drop_tables": false,
      "want_runecraft": false
    }
  }
}
